,author,title,description,url,urlToImage,publishedAt,content,source.id,source.name
34,Ted Johnson,CBS News’ JD Vance-Tim Walz Debate Will Feature Hot Mics,"CBS News unveiled the rules for Tuesday’s vice presidential debate between Republican JD Vance and Democrat Tim Walz, indicating that the candidates mics will not be muted during the event. “CBS News reserves the right to turn off candidate microphones,” the …",http://deadline.com/2024/09/vice-presidential-debate-mics-cbs-news-vance-walz-1236101982/,https://deadline.com/wp-content/uploads/2024/08/Tim-Walz-and-JD-Vance.jpg?w=1024,2024-09-27T19:17:23Z,"CBS News unveiled the rules for Tuesday’s vice presidential debate between Republican JD Vance and Democrat Tim Walz, indicating that the candidates mics will not be muted during the event.
“CBS New… [+1453 chars]",,Deadline
35,businessinsider.com,The JD Vance and Tim Walz debate is likely the last big night of the 2024 campaign. Here's what to expect,"Tim Walz and JD Vance will be secondary characters in their own debate.
Drew Hallowell/Getty Images; Andrew Harnik/Getty Images; Brandon Bell/Getty Images; Rebecca Zisser/BI
Ohio Sen. JD Vance and Minnesota Gov. Tim Walz will face off in their long-awaited de…",https://biztoc.com/x/6d927049502aaf2d,https://biztoc.com/cdn/6d927049502aaf2d_s.webp,2024-09-28T11:38:33Z,Tim Walz and JD Vance will be secondary characters in their own debate.Drew Hallowell/Getty Images; Andrew Harnik/Getty Images; Brandon Bell/Getty Images; Rebecca Zisser/BIOhio Sen. JD Vance and Minn… [+139 chars],,Biztoc.com
36,"Sara Dorn, Forbes Staff, 
 Sara Dorn, Forbes Staff
 https://www.forbes.com/sites/saradorn/",Vance-Walz Debate: Here’s What To Know—Including How To Watch,The debate is set for Tuesday at 9 p.m. EDT on CBS.,https://www.forbes.com/sites/saradorn/2024/09/30/vance-walz-debate-heres-what-to-know-including-how-to-watch/,https://imageio.forbes.com/specials-images/imageserve/66f2e1919e5dd65b7aa2a9c4/0x0.jpg?format=jpg&height=900&width=1600&fit=bounds,2024-09-30T19:42:42Z,"Republican vice presidential nominee, Sen. JD Vance, R-Ohio, and Democratic vice presidential candidate, Minnesota Gov. Tim Walz, will debate Tuesday on CBS in their first faceoff and what could be t… [+4940 chars]",,Forbes
37,"Sara Dorn, Forbes Staff, 
 Sara Dorn, Forbes Staff
 https://www.forbes.com/sites/saradorn/",Mics Will Be Unmuted During Next Week’s Vance-Walz Debate—Here’s What Else To Know About The Faceoff,The debate is set for Oct. 1 at 9 p.m. ET on CBS.,https://www.forbes.com/sites/saradorn/2024/09/27/mics-will-be-unmuted-during-next-weeks-vance-walz-debate-heres-what-else-to-know-about-the-faceoff/,https://imageio.forbes.com/specials-images/imageserve/66f2e1919e5dd65b7aa2a9c4/0x0.jpg?format=jpg&height=900&width=1600&fit=bounds,2024-09-27T17:21:38Z,"Republican vice presidential nominee, Sen. JD Vance, R-Ohio, and Democratic vice presidential candidate, Minnesota Gov. Tim Walz, will debate Tuesday with unmuted microphones, a departure from the ru… [+5062 chars]",,Forbes
38,COLLEEN LONG,Some Republicans distance themselves from Trump's latest attack on Harris' mental fitness,Republicans on Sunday sought to distance themselves from Donald Trump's latest insults of Democratic nominee Kamala Harris during a rambling weekend rally in...,https://www.yahoo.com/news/republicans-distance-themselves-trumps-attack-155925937.html,https://s.yimg.com/ny/api/res/1.2/tTDO6e0AGKLlp0ejZUG_hQ--/YXBwaWQ9aGlnaGxhbmRlcjt3PTEyMDA7aD02NzY-/https://media.zenfs.com/en/ap.org/b3a0f178fc82c17dccf34f91e7bd5212,2024-09-29T15:59:25Z,WASHINGTON (AP) Republicans on Sunday sought to distance themselves from Donald Trump's latest insults of Democratic nominee Kamala Harris during a rambling weekend rally in Wisconsin in which he cal… [+2914 chars],,Yahoo Entertainment
39,Nicholas Florko,The GOP’s Tipping Point on Weed,"Only four solidly red states have legalized marijuana. With Trump’s support, Florida may soon be the fifth.",https://www.theatlantic.com/health/archive/2024/09/florida-trump-recreational-marijuana/680077/,https://cdn.theatlantic.com/thumbor/GumBdJURlugHtgFW1ZmNSZjBb-A=/0x43:2000x1085/1200x625/media/img/mt/2024/09/GOP_Cannabis-1/original.png,2024-09-30T10:30:00Z,"One Sunday earlier this month, Dave Portnoy ordered a pizza, plopped down on his couch to watch football, and lit a blunt. He was angry. The Barstool Sports founder, who is beloved by many right-lean… [+8309 chars]",,The Atlantic
40,Tom Nichols,The Election’s No-Excuses Moment,Voters know all they need to know—especially about Trump.,https://www.theatlantic.com/newsletters/archive/2024/09/the-elections-no-excuses-moment/680092/,https://cdn.theatlantic.com/thumbor/rw7nKo3RbcFYNoLwwhETkG7vJKM=/0x520:4993x3120/1200x625/media/img/mt/2024/09/GettyImages_2167607156/original.jpg,2024-09-30T23:21:00Z,"This is an edition of The Atlantic Daily, a newsletter that guides you through the biggest stories of the day, helps you discover new ideas, and recommends the best in culture. Sign up for it here.Th… [+10167 chars]",,The Atlantic
41,Barry Ritholtz,10 Vacation Sunday Reads,"My Sunday morning look at incompetency, corruption and policy failures: • Messing Up the Closest Thing to a Sure Thing in the Stock Market: Index funds are a great way to match the performance of the market. So why do so many investors end up falling short? (…",https://ritholtz.com/2024/09/sunday-reads-387/,https://ritholtz.com/wp-content/uploads/2024/12/microplastics.jpg,2024-09-29T10:30:19Z,Messing Up the Closest Thing to a Sure Thing in the Stock Market: Index funds are a great way to match the performance of the market. So why do so many investors end up falling short? (Wall Street Jo… [+2474 chars],,Ritholtz.com
42,Dan Ladden-Hall,JD Vance’s Leaked DMs Show Him STILL Trashing Trump in 2020,"Drew Angerer/Getty Images
JD Vance was privately criticizing Donald Trump’s performance as president just four years ago, according to a report.Direct messages sent by the current Republican vice presidential nominee to an unnamed acquaintance on Twitter, no…",https://www.thedailybeast.com/jd-vances-leaked-dms-show-him-still-trashing-donald-trump-in-2020,"https://img.thedailybeast.com/image/upload/c_crop,d_placeholder_euli9k,h_1215,w_2160,x_0,y_88/dpr_2.0/c_limit,w_740/fl_lossy,q_auto/v1727436657/GettyImages-1439889640_bndoqy",2024-09-27T11:47:02Z,"JD Vance was privately criticizing Donald Trumps performance as president just four years ago, according to a report.
Direct messages sent by the current Republican vice presidential nominee to an u… [+2228 chars]",,Daily Beast
43,Ed Scarce,JD Vance Takes On The Scourge Of Children's Car Seat Rules,"Ostensibly, JD Vance was supposed to be talking about consumer protections in the airline industry, but at the end of his time he went off on another wild tangent about seat belt laws contributing to lower fertility in American families, another one of his cr…",https://crooksandliars.com/2024/09/jd-vance-takes-scourge-childrens-car-seat,https://crooksandliars.com/files/mediaposters/2024/09/55741.jpg,2024-09-27T20:01:42Z,"Ostensibly, JD Vance was supposed to be talking about consumer protections in the airline industry, but at the end of his time he went off on another wild tangent about seat belt laws contributing to… [+1557 chars]",,Crooksandliars.com
44,Sean Craig,Inside Trump’s Surprising ‘Father Figure’ Bond With Vance,"Stephen Maturen/Getty Images
Former President Donald Trump is apparently smitten with his running mate, Ohio Senator JD Vance, calling him up at all hours of the day to check in on and encourage his MAGA protégé in what Vance likens as “a kind of father figu…",https://www.thedailybeast.com/trump-is-jd-vances-father-figure-bestie-who-calls-him-at-all-hours-of-the-day,"https://img.thedailybeast.com/image/upload/c_crop,d_placeholder_euli9k,h_3094,w_5500,x_0,y_456/dpr_2.0/c_limit,w_740/fl_lossy,q_auto/v1727619509/GettyImages-2163348245_nhr5dy",2024-09-29T14:39:40Z,"Former President Donald Trump is apparently smitten with his running mate, Ohio Senator JD Vance, calling him up at all hours of the day to check in on and encourage his MAGA protégé in what Vance li… [+2305 chars]",,Daily Beast
45,pbs.org,News Wrap: Vance and Walz campaign in battleground states days before VP debate,"In our news wrap Saturday, vice presidential candidates JD Vance and Tim Walz campaigned in the battleground states of Pennsylvania and Michigan, two separate Russian drone attacks in northeastern Ukraine killed nearly a dozen people, and SpaceX launched a mi…",https://biztoc.com/x/9a66419826bc5471,https://biztoc.com/cdn/9a66419826bc5471_s.webp,2024-09-28T21:43:11Z,"In our news wrap Saturday, vice presidential candidates JD Vance and Tim Walz campaigned in the battleground states of Pennsylvania and Michigan, two separate Russian drone attacks in northeastern Uk… [+132 chars]",,Biztoc.com
46,Mike Masnick,Don’t Forget That The Same People Banning Books Want To Ban Porn,"PEN America published recent data on book bans and removals just in time for Banned Books Week. Key findings indicate that most books challenged by censorship advocates this past year focus on LGBTQ+ subject matter. Additionally, Iowa and Florida are currentl…",https://www.techdirt.com/2024/09/27/dont-forget-that-the-same-people-banning-books-want-to-ban-porn/,https://www.techdirt.com/wp-content/themes/techdirt/assets/images/td-rect-logo-white.png,2024-09-27T20:00:00Z,"from the umm-no-shit-Sherlock dept
PEN America published recent data on book bans and removals just in time for Banned Books Week.
Key findings indicate that most books challenged by censorship adv… [+5564 chars]",,Techdirt
47,Tom Jones,To fact-check or not: the big question ahead of another debate,"There’s a debate this week. Vice presidential candidates JD Vance and Tim Walz will square off Tuesday at 9 p.m. Eastern. CBS will host with “Face the Nation” moderator Margaret […]
The post To fact-check or not: the big question ahead of another debate appea…",https://www.poynter.org/commentary/2024/cbs-news-moderators-fact-check-debate-jd-vance-tim-walz/,https://www.poynter.org/wp-content/uploads/2024/09/unnamed-2024-09-29T202703.538.jpg,2024-09-30T11:30:38Z,Theres a debate this week. Vice presidential candidates JD Vance and Tim Walz will square off Tuesday at 9 p.m. Eastern. CBS will host with Face the Nation moderator Margaret Brennan and CBS Evening … [+12118 chars],,Poynter
48,Ed Scarce,JD Vance Denied Service At Famous Pittsburgh Sandwich Shop,"So...JD Vance wanted to do one of those man-of-the-people things where he'd go into a sandwich shop, talk to the locals like he's actually a real human being, just like them, and get a campaign appearance by paying for their food. Only one slight problem, no …",https://crooksandliars.com/2024/09/jd-vance-denied-service-famous-pittsburgh,https://crooksandliars.com/files/embeds/2024/09/62413.jpg,2024-09-29T16:24:50Z,"So...JD Vance wanted to do one of those man-of-the-people things where he'd go into a sandwich shop, talk to the locals like he's actually a real human being, just like them, and get a campaign appea… [+3392 chars]",,Crooksandliars.com
49,,[Removed],[Removed],https://removed.com,,2024-09-30T18:56:31Z,[Removed],,[Removed]
50,Liz Wolfe,More Vance Than Anyone Could Ever Need,"Plus: Long live Eric Adams, Electoral College bias, and more...",https://reason.com/2024/09/27/more-vance-than-anyone-could-ever-need/,https://d2eehagpk5cl65.cloudfront.net/img/q60/uploads/2023/05/vancecpac-scaled-e1684434076231.jpg,2024-09-27T14:00:45Z,"Vance dossier: On Thursday, X suspended the account of Ken Klippenstein, an independent journalist who formerly wrote for The Intercept, due to his sharing of the Donald Trump campaign's vetting doss… [+9285 chars]",,Reason
51,,[Removed],[Removed],https://removed.com,,2024-09-30T17:42:12Z,[Removed],,[Removed]
52,Edith Olmsted,J.D. Vance’s Christian Nationalist Ties Are Growing,"The Republican vice presidential nominee will attend an event in Monroeville, Pennsylvania, on Saturday hosted by The Lance Wallnau Show.
Wallnau is a one of the leaders of the New Apostolic Reformation, or NAR, a sect of evangelical Christianity devoted to …",https://newrepublic.com/post/186446/jd-vances-christian-nationalist-ties-growing,https://images.newrepublic.com/15f346d5406a7921dc1b9832cfdfc2bf3560a1cb.jpeg?w=1200&h=630&crop=faces&fit=crop&fm=jpg,2024-09-27T15:13:03Z,"The bill stands little chance of passing, particularly in the Republican-controlled House. But it is the strongest proposal from Democrats for reforming the judiciary, not only tackling the Supreme C… [+1117 chars]",,The New Republic
53,Abby Jones,Bowen Yang Parodies Charli XCX And Chappell Roan (As Moo Deng) On SNL,"A lot has happened in the past week: Charli XCX and Troye Sivan brought their Sweat Tour to New York, Kamala Harris and Donald Trump’s campaigns marched along, and the entire world fell in love with a pygmy hippopotamus. Plenty of material for SNL to work wit…",https://www.stereogum.com/2282340/bowen-yang-parodies-charli-xcx-and-chappell-roan-as-moo-deng-on-snl/news/,https://static.stereogum.com/uploads/2024/09/snl-chappell-roan-moo-deng-1727623328.jpg,2024-09-29T15:36:26Z,"A lot has happened in the past week: Charli XCX and Troye Sivan brought their Sweat Tour to New York, Kamala Harris and Donald Trump’s campaigns marched along, and the entire world fell in love with … [+1863 chars]",,Stereogum
54,,[Removed],[Removed],https://removed.com,,2024-09-29T10:00:49Z,[Removed],,[Removed]
55,Harrison Richlin,"Andy Samberg, Jim Gaffigan, and Dana Carvey Join Maya Rudolph for ‘SNL’ Season 50 Premiere’s Cold Open","We knew Rudolph was returning to play presidential hopeful Kamala Harris, and now we know who's playing her husband, Doug Emhoff, her VP pick, Tim Walz, and her former boss, Joe Biden.",https://www.indiewire.com/news/general-news/maya-rudolph-snl-season-50-premiere-cold-open-1235052178/,https://www.indiewire.com/wp-content/uploads/2024/09/Screenshot-2024-09-29-at-8.15.13 AM.png?w=650,2024-09-29T16:30:00Z,While it was all but official that Maya Rudolph would be playing Democratic presidential nominee Kamala Harris on “Saturday Night Live” Season 50 the minute President Joe Biden dropped out and endors… [+4066 chars],,IndieWire
56,Sean Craig,‘Bad Debater’ Tim Walz is Terrified He’s Going to Let Kamala Harris Down at VP Debate,"Andrew Harnik/Getty Images
Minnesota Governor and Democratic Vice Presidential candidate Tim Walz is constantly freaking out that he is going to let Vice President Kamala Harris down and screw up in his debate against Ohio Senator JD Vance this week, accordi…",https://www.thedailybeast.com/bad-debater-tim-walz-is-terrified-hes-going-to-let-kamala-harris-down-at-vp-debate,"https://img.thedailybeast.com/image/upload/c_crop,d_placeholder_euli9k,h_460,w_818,x_101,y_158/dpr_2.0/c_limit,w_740/fl_lossy,q_auto/v1727616437/GettyImages-2165581657_1_lwtlbv",2024-09-29T13:39:46Z,Minnesota Governor and Democratic Vice Presidential candidate Tim Walz is constantly freaking out that he is going to let Vice President Kamala Harris down and screw up in his debate against Ohio Sen… [+2749 chars],,Daily Beast
57,Ellie Quinlan Houghtaling,Trump Ally Forced to Make Embarrassing Admission on Health Care Plan,"After spending nine years on the campaign trail and four years in the Oval Office, Donald Trump still doesn’t seem to have a comprehensive health care plan for the American people—at least, that’s according to some of the Republican presidential nominee’s own…",https://newrepublic.com/post/186513/donald-trump-ally-embarrassing-admission-health-care-plan,https://images.newrepublic.com/1cee5cc0c0024a0c97bc2d984e37369617c5d7b0.jpeg?w=1200&h=630&crop=faces&fit=crop&fm=jpg,2024-09-30T16:54:51Z,"Now, if you had one really violent daylike a guy like, Mike Kelly, put him in charge, Congressman Kelly, put him in charge for one dayMike would you say, youre right here, hes a great congressman, wo… [+959 chars]",,The New Republic
58,NBC News,Trump surrogates hit the road; Harris disputes his fentanyl claim,The latest news and live updates on the 2024 election. Follow the Trump-Vance and Harris-Walz campaigns ahead of the presidential election in November.,https://www.nbcnews.com/politics/2024-election/live-blog/harris-trump-presidential-election-live-updates-rcna173047,"https://media-cldnry.s-nbcnews.com/image/upload/t_nbcnews-fp-1200-630,f_auto,q_auto:best/rockcms/2024-09/240927-spit-trump-harris-ch-1314-0e41e2.jpg",2024-09-30T11:22:27Z,"LAS VEGAS Harris said yesterday that she would double Justice Department resources to crack down on cartels and cut the flow of fentanyl into the U.S., just hours after Trump repeated his false claim… [+508 chars]",nbc-news,NBC News
59,,[Removed],[Removed],https://removed.com,,2024-09-30T19:02:34Z,[Removed],,[Removed]
60,Sean Craig,CBS Says It’s On Vance and Walz to Fact Check Each Other at VP Debate,"Bill Clark/Getty Images
CBS News moderators will not fact-check Ohio Senator JD Vance and Minnesota Governor Tim Walz when they host a debate between the two major party vice presidential candidates Tuesday, leaving it up to the two to do it themselves.The 9…",https://www.thedailybeast.com/vance-and-walz-can-fact-check-each-other-at-veep-debate-cbs-says,"https://img.thedailybeast.com/image/upload/c_crop,d_placeholder_euli9k,h_1978,w_3516,x_0,y_249/dpr_2.0/c_limit,w_740/fl_lossy,q_auto/v1727628355/GettyImages-2167033935_gguc7q",2024-09-29T16:57:33Z,"CBS News moderators will not fact-check Ohio Senator JD Vance and Minnesota Governor Tim Walz when they host a debate between the two major party vice presidential candidates Tuesday, leaving it up t… [+1948 chars]",,Daily Beast
61,David Edwards,Don Jr. Says He's 'Totally Vindicated' After Picking J.D. Vance As Dad's VP Nom,"Donald Trump Jr., son of former President Donald Trump, claimed ""total"" vindication after pushing his father to pick unpopular Sen. J.D. Vance (R-OH) as the Republican vice presidential running mate.


During a Sunday interview on Fox News, host Maria Bartiro…",https://crooksandliars.com/2024/09/don-jr-says-hes-totally-vindicated-after,https://crooksandliars.com/files/primary_image/24/09/fnc_don_jr_vance_1-720p_to_mov-0001-enhanced-sr.jpg,2024-09-30T01:00:01Z,"Donald Trump Jr., son of former President Donald Trump, claimed ""total"" vindication after pushing his father to pick unpopular Sen. J.D. Vance (R-OH) as the Republican vice presidential running mate.… [+1481 chars]",,Crooksandliars.com
62,Matt Solomon,‘SNL’ Kicks Off Season 50 With Obvious Cameos and Toothless Satire,"By Matt Solomon Published: September 29th, 2024",https://www.cracked.com/article_43768_snl-kicks-off-season-50-with-obvious-cameos-and-toothless-satire.html,https://s3.crackedcdn.com/phpimages/article/6/4/5/1158645.jpg,2024-09-29T13:30:00Z,I hope the first cold open of Season 50 isnt a harbinger of what Saturday Night Live will look like during its anniversary year. With an opening sketch devoted to what else? the upcoming Presidential… [+2950 chars],,Cracked.com
63,Ed Kilgore,J.D. Vance Embraces Trump’s Scary Christian Nationalist Fans,The very Catholic veep candidate J.D. Vance is joining hands with Protestant spiritual warriors like Lance Wallnau in fighting the demonic Kamala Harris at a Courage Tour event in Pennsylvania.,http://nymag.com/intelligencer/article/j-d-vance-embraces-trumps-scary-christian-nationalist-fans.html,https://pyxis.nymag.com/v1/imgs/d34/d32/40be846ecbf4e980d71baed750cb27cf63-couragetour-twitter.1x.rsocial.w1200.jpg,2024-09-27T18:05:00Z,"Heading toward his October 1 debate with his Democratic counterpart Tim Walz, the rap on Republican vice-presidential nominee J.D. Vance is that he represents some of the more disturbing elements of … [+5805 chars]",new-york-magazine,New York Magazine
64,David Edwards,'It Is Not True': ABC Host Interrupts Top Vance Surrogate On Pet-eating Claims,"ABC News host Martha Raddatz interrupted a top surrogate for Republican vice presidential nominee J.D. Vance Sunday after he refused to deny false claims that Haitians are eating pets in Springfield, Ohio.


Rep. Tom Emmer (R-MN), who is helping Vance prepare…",https://crooksandliars.com/2024/09/it-not-true-abc-host-interrupts-top-vance,https://crooksandliars.com/files/primary_image/24/09/emmer_raddatz_1-enhanced-sr.jpg,2024-09-29T14:34:13Z,"ABC News host Martha Raddatz interrupted a top surrogate for Republican vice presidential nominee J.D. Vance Sunday after he refused to deny false claims that Haitians are eating pets in Springfield,… [+1640 chars]",,Crooksandliars.com
65,Walter Einenkel,"Tim Walz Is Very Good At This, Part Infinity","One of Minnesota Gov. Tim Walz’s strengths is his down-to-earth, approachable personality, something only accentuated by how weird Ohio Sen. JD Vance repeatedly acts. 
On Tuesday, Walz posted a short video from a campaign stop last week at local eatery H&H So…",https://crooksandliars.com/2024/09/tim-walz-very-good-part-infinity,https://crooksandliars.com/files/primary_image/24/09/53914412172_8c44ae49e6_z.jpg,2024-09-27T12:37:37Z,"One of Minnesota Gov. Tim Walzs strengths is his down-to-earth, approachable personality, something only accentuated by how weird Ohio Sen. JD Vance repeatedly acts. 
On Tuesday, Walz posted a short… [+675 chars]",,Crooksandliars.com
66,RT,Journalist banned from X after publishing ‘hacked’ J.D. Vance dossier,Independent journalist Ken Klippenstein has been suspended from X after publishing a dossier compiled by the Trump campaign Read Full Article at RT.com,https://www.rt.com/news/604751-journalist-suspended-vance-dossier/,https://mf.b37mrtl.ru/files/2024.09/article/66f5f5ed2030272c386063fa.jpg,2024-09-27T00:06:34Z,Independent journalist Ken Klippenstein has been suspended from the social media platform X (formerly Twitter) after publishing a dossier compiled by former President Donald Trump’s campaign during i… [+3048 chars],rt,RT
67,Karen Valby,‘SNL’ Returns With Maya Rudolph’s Kamala Harris and an Ace Lineup of Election Impressions,"Saturday night saw the debut of Jim Gaffigan’s Tim Walz, Dana Carvey’s Joe Biden, and Bowen Yang’s J.D. Vance—great performances that unfortunately overshadowed host Jean Smart.",https://www.vanityfair.com/hollywood/story/snl-maya-rudolph-kamala-harris-election-impressions,"https://media.vanityfair.com/photos/66f936020c5040b58e55afb5/16:9/w_1280,c_limit/NUP_205787_00003.JPG",2024-09-29T11:13:45Z,"James Austin Johnson returned as Donald Trump, predictably shouting about Haitians eating cats and dogs and forcing them to attend Diddys freak-offs. But it was SNLs decision to tap Bowen Yang as Tru… [+2690 chars]",,Vanity Fair
68,Glenn Garner,Zachary Levi Endorses Trump After RFK Jr. Exit: “Make It Great Again”,"Although Shazam! Fury of the Gods was a box office bomb, perhaps Zachary Levi‘s latest attempt at a sequel will pan out for him. During a Donald Trump rally on Saturday in Michigan, the actor name-dropped his DC role while making a surprise appearance to endo…",http://deadline.com/2024/09/zachary-levi-endorses-trump-after-rfk-jr-exit-1236102955/,https://deadline.com/wp-content/uploads/2024/09/Zachary-Levi-2153311236.jpg?w=1024,2024-09-29T16:37:07Z,"With less than two months to spare, Zachary Levi is making his political allegiance clear ahead of the 2024 presidential election.
During a Donald Trump rally on Saturday in Michigan, the actor name… [+2420 chars]",,Deadline
69,NBC News,Harris seeks to tackle a political vulnerability on visit to southern border,The latest news and live updates on the 2024 election. Follow the Trump-Vance and Harris-Walz campaigns as they stump near the border ahead of the presidential election in November.,https://www.nbcnews.com/politics/2024-election/live-blog/harris-trump-presidential-election-live-updates-rcna172165,"https://media-cldnry.s-nbcnews.com/image/upload/t_nbcnews-fp-1200-630,f_auto,q_auto:best/rockcms/2024-09/240909-donald-trump-kamala-harris-vl-520p-c2a39b.jpg",2024-09-27T11:27:16Z,The war for the first battleground electoral vote may have been decided this week before a single ballot was cast. The weapons of choice: private polls. The likely winner: Vice President Kamala Harri… [+1367 chars],nbc-news,NBC News
70,John Amato,MAGA Pastor Lance Wallnau To Host JD Vance After Calling Harris 'Jezebel',"MAGA pastor and televangelist Lance Wallnau is hosting a town hall with JD Vance on Saturday at Monroeville Convention Center in Pennsylvania after attacking Kamala Harris for using the ""occult spirit"" and ""witchcraft"" to thwart Demented Donald.
Wallnau cover…",https://crooksandliars.com/2024/09/pastor-lance-wallnau-kamala-witch-jd-vance,https://crooksandliars.com/files/mediaposters/2024/09/55750.jpg,2024-09-28T15:00:01Z,"MAGA pastor and televangelist Lance Wallnau is hosting a town hall with JD Vance on Saturday at Monroeville Convention Center in Pennsylvania after attacking Kamala Harris for using the ""occult spiri… [+1690 chars]",,Crooksandliars.com
