,author,title,description,url,urlToImage,publishedAt,content,source.id,source.name
69,Yashraj Sharma,US election: Why is Kamala Harris losing Indian American voters?,She could become the Indian American president. So why is she bleeding votes - to Trump's advantage?,https://www.aljazeera.com/news/2024/11/1/us-election-why-is-kamala-harris-losing-indian-american-voters,https://www.aljazeera.com/wp-content/uploads/2024/11/AP24136796966617-1730432181.jpg?resize=1920%2C1440,2024-11-01T04:17:48Z,Democratic presidential candidate Kamala Harris is projected to lose a segment of her partys traditional share of Indian American voters who have historically sided with the Democrats in the 2024 Uni… [+10506 chars],al-jazeera-english,Al Jazeera English
70,Andy Hirschfeld,"Despite stark differences on worker rights, unions split on Trump, Harris",Trump has garnered support among union members by tapping into issues that are top of mind of the broader electorate.,https://www.aljazeera.com/economy/2024/11/1/despite-stark-differences-on-worker-rights-unions-split-on-trump-harris,https://www.aljazeera.com/wp-content/uploads/2023/09/AP23235765695912-1694970152.jpg?resize=1920%2C1440,2024-11-01T21:37:35Z,Early voting is under way across the United States ahead of Tuesdays presidential election. Republican candidate Donald Trump and Democratic candidate Kamala Harris have both made last-minute efforts… [+9729 chars],al-jazeera-english,Al Jazeera English
71,"Stephen Pastis, Forbes Staff, 
 Stephen Pastis, Forbes Staff
 https://www.forbes.com/sites/stephenpastis/","Joe Rogan Baselessly Claims YouTube Search Suppressed Trump Interview, Talks Harris In Latest Episode",Rogan’s latest podcast episode interviewing Donald Trump faced technical difficulties early on. But now Rogan says it has a bigger issue.,https://www.forbes.com/sites/stephenpastis/2024/10/31/joe-rogan-baselessly-claims-youtube-search-suppressed-trump-interview-talks-harris-in-latest-episode/,"https://imageio.forbes.com/specials-images/imageserve/672395245ffcc344671389c9/0x0.jpg?format=jpg&crop=2488,1400,x0,y0,safe&height=900&width=1600&fit=bounds",2024-10-31T14:22:27Z,"Joe Rogan says his interview with former President Donald Trump faced an issue that prevented it from surfacing on YouTubes search function, a problem Google reportedly said it addressed, as he now a… [+5113 chars]",,Forbes
72,Ray Flook,"Will Saturday Night Live Seize on Trump's ""Intimate"" Mic Moment?","Tonight marks the final edition of NBC's Saturday Night Live before voters in the U.S. head to the polls to decide between Vice President Kamala Harris and Gov. Tim Walz and ex-reality show host, multi-impeached ex-POTUS, and convicted felon Donald Trump and …",https://bleedingcool.com/tv/will-saturday-night-live-seize-on-trumps-intimate-mic-moment/,https://bleedingcool.com/wp-content/uploads/2024/11/MixCollage-02-Nov-2024-11-56-AM-5666-2000x1125.jpg,2024-11-02T16:45:10Z,"Posted in: NBC, Opinion, Peacock, TV, TV | Tagged: opinion, saturday night live, snl, trump
With tonight's Saturday Night Live being the final one before the election, will SNL seize on Trump's ""int… [+3260 chars]",,Bleeding Cool News
73,Jill Filipovic,Melania Trump's book highlights a disappointing truth about the Trump-Vance ticket,"Melania Trump's book sales have been lackluster, possibly because it's so boring. But the book does connect the dots between Donald, Melania, JD Vance and Usha.",https://www.msnbc.com/opinion/msnbc-opinion/melania-trump-book-jd-vance-wife-usha-rcna177936,"https://media-cldnry.s-nbcnews.com/image/upload/t_nbcnews-fp-1200-630,f_auto,q_auto:best/rockcms/2024-10/241030-donald-trump-melania-jd-vance-usha-ew-619p-409d88.jpg",2024-10-31T10:00:00Z,"Who, exactly, is Melania Trump? Since the sphinx-eyed former model came onto the political scene alongside her husband, former President Donald Trump, shes been something of an enigma: often seemingl… [+6609 chars]",msnbc,MSNBC
74,Ray Flook,"Gen V, Squid Game, Twin Peaks/Trump & More: BCTV Daily Dispatch","Welcome back, folks! Once again, My Chemical Romance kicks things off with ""Sing"" (BCTV DD's unofficial ""official"" theme song) – welcome back to the BCTV Daily Dispatch! Here's where we look back at what we've been doing for the past 24 hours that you might'v…",https://bleedingcool.com/tv/gen-v-squid-game-twin-peaks-trump-more-bctv-daily-dispatch/,https://bleedingcool.com/wp-content/uploads/2024/10/MixCollage-31-Oct-2024-11-27-PM-5322-2000x1125.jpg,2024-11-01T11:37:08Z,"Posted in: streaming, TV | Tagged: bctv daily dispatch, television
In today's BCTV Daily Dispatch: Twin Peaks/Trump &amp; Vance, Gen V, Fire Country &amp; Jared Padalecki, Squid Game, Yellowjackets,… [+3496 chars]",,Bleeding Cool News
75,Erik De La Garza,'Crazy!' CNN panel bursts into laughter over clip of J.D. Vance on Joe Rogan's podcast,A CNN panel Thursday night wasn’t buying theories floated by Sen. J.D. Vance that he and Donald Trump had the support of “the normal gay guy” before adding that “a lot of upper-middle-class kids” have become “trans” to get into elite universities. The eyebrow…,https://www.rawstory.com/jd-vance-2669560489/,https://www.rawstory.com/media-library/a-cnn-panel-thursday-night-wasnt-buying-theories-floated-by-sen-j-d-vance-that-he-and-donald-trump-had-the-support-of-the-no.png?id=54094954&width=1200&height=600&coordinates=0%2C21%2C0%2C21,2024-11-01T01:31:07Z,A CNN panel Thursday night wasnt buying theories floated by Sen. J.D. Vance that he and Donald Trump had the support of the normal gay guy before adding that a lot of upper-middle-class kids have bec… [+2142 chars],,Raw Story
76,Alex Griffing,JD Vance Says Trump Shooting Made Him Rush Home and Load ‘All’ His Guns,"Sen. JD Vance (R-OH) recalled to Joe Rogan on Wednesday the moment he heard about the Pennsylvania assassination attempt on former President Donald Trump. Vance, who would be named Trump’s running mate days after the shooting, told the popular podcast host ho…",https://www.mediaite.com/politics/jd-vance-says-trump-shooting-made-him-rush-home-and-load-all-his-guns/,https://www.mediaite.com/wp-content/uploads/2024/10/Screenshot-2024-10-23-at-5.20.30 PM.png,2024-10-31T19:34:28Z,"Sen. JD Vance (R-OH) recalled to Joe Rogan on Wednesday the moment he heard about the Pennsylvania assassination attempt on former President Donald Trump. Vance, who would be named Trumps running mat… [+1570 chars]",,Mediaite
77,John Power,"What Joe Rogan, Washington Post dramas say about the US election and media","Trump and Harris have both shunned newspapers in favour of podcasts, highlighting media's struggle for relevance.",https://www.aljazeera.com/economy/2024/10/31/what-joe-rogan-washington-post-dramas-say-about-the-us-election-and-media,https://www.aljazeera.com/wp-content/uploads/2024/10/AP19039726318882-1-1730276173.jpg?resize=1920%2C1440,2024-10-31T02:59:44Z,"Two stories about the United States presidential election this week highlight the total transformation of the news business.
One involves Joe Rogan, the worlds most popular podcaster.
The other con… [+4490 chars]",al-jazeera-english,Al Jazeera English
78,Sean Burch,JD Vance Says ‘Emily in Paris’ Is a ‘Masterpiece’,"The vice presidential hopeful's comment comes after star Lily Collins said she was voting for Kamala Harris earlier this week 
The post JD Vance Says ‘Emily in Paris’ Is a ‘Masterpiece’ appeared first on TheWrap.",https://www.thewrap.com/jd-vance-emily-in-paris-masterpiece-joe-rogan-podcast/,https://www.thewrap.com/wp-content/uploads/2024/11/JD_Vance.png,2024-11-01T16:37:28Z,"Lily Collins may not be voting for Donald Trump and JD Vance, but she could end up getting an invitation to the White House if they win, anyway.
Thats because Vance, during his Thursday appearance o… [+1355 chars]",,TheWrap
79,CBS News,"Offensive comments taking off before Trump, Harris race ends","Offensive comments made in the last days before the Nov. 5 election are shadowing a key week for both presidential candidates to sway 2024 undecided voters. Former President Donald Trump's comments about former Rep. Liz Cheney are drawing criticism, while Vic…",https://www.cbsnews.com/video/offensive-comments-taking-off-before-trump-harris-race-ends/,https://assets1.cbsnewsstatic.com/hub/i/r/2024/11/01/eb360222-3cf5-4292-a685-6bd44fa1bdc6/thumbnail/1200x630/93726e81672222fdaacfed593b09ca17/cbsn-fusion-offensive-comments-taking-off-before-trump-harris-race-ends-thumbnail.jpg?v=379420b9063a2aadbcd559df18e2d1ae,2024-11-01T19:46:00Z,"Watch CBS News
Copyright ©2024 CBS Interactive Inc. All rights reserved.
Get browser notifications for breaking news, live events, and exclusive reporting.
Not NowTurn On",cbs-news,CBS News
80,Tristan Justice,"Vance Says The Problem With The Washington Post Lies In Its ‘Journalism,’ ‘Not With The Editorials’","'I don't care, frankly, whether the editorial page endorses Donald Trump or Kamala Harris,' said J.D. Vance.",https://thefederalist.com/2024/11/01/vance-says-the-problem-with-the-washington-post-lies-in-its-journalism-not-with-the-editorials/,https://thefederalist.com/wp-content/uploads/2024/11/Vance.jpg,2024-11-01T15:13:20Z,"Republican vice presidential candidate J.D. Vance diagnosed the problems with the Washington Post as residing in the paper’s overall “journalism” rather than just on the editorial page.
“The Washing… [+4107 chars]",,The Federalist
81,Breccan F. Thies,Vance: Biden-Harris Border Invasion Is ‘Fundamentally The End Of American Democracy’,"Vance explained the demographic, political, and corporate interests behind Democrats' motivation to bring millions of illegals to America.",https://thefederalist.com/2024/11/01/vance-biden-harris-border-invasion-is-fundamentally-the-end-of-american-democracy/,https://thefederalist.com/wp-content/uploads/2024/10/Screenshot-2024-10-31-182126.png,2024-11-01T11:26:43Z,"Sen. J.D. Vance, R-Ohio, Republican nominee for vice president, described the interwoven interests of corporations and the Democrats advocating for open borders at the expense of the American people,… [+4649 chars]",,The Federalist
82,Taegan Goddard,J.D. Vance Says Kids ‘Become Trans’ to Get Into College,"Sen. J.D. Vance (R-OH) suggested in an interview with podcast host Joe Rogan that aired Thursday that White upper- and middle-class children are incentivized to identify as transgender to gain admission to elite colleges, CNN reports.Said Vance: “Think about …",https://politicalwire.com/2024/10/31/vance-says-kids-become-trans-to-get-into-college/,https://politicalwire.com/wp-content/uploads/2018/02/PW-podcast-logo.jpg,2024-10-31T22:34:14Z,"“There are a lot of blogs and news sites claiming to understand politics, but only a few actually do. Political Wire is one of them.”
 Chuck Todd, host of “Meet the Press”
“Concise. Relevant. To th… [+594 chars]",,Politicalwire.com
83,Just Jared,"Meet Kamala Harris' Family, Including Her Husband & 2 Step-Children","Vice President Kamala Harris is going to be spending the next few days in the spotlight in the leadup to the 2024 election, where she hopes to beat Donald Trump and become the next president of the United States. The election will take place on Tuesday (Novem…",https://www.justjared.com/2024/11/01/meet-kamala-harris-family-including-her-husband-2-step-children/,https://cdn01.justjared.com/wp-content/uploads/headlines/2024/11/kamala-family.jpg,2024-11-01T18:44:01Z,"Vice President Kamala Harris is going to be spending the next few days in the spotlight in the leadup to the 2024 election, where she hopes to beat Donald Trump and become the next president of the U… [+665 chars]",,Just Jared
84,Colby Hall,Anderson Cooper’s CNN Panel Laughs Out Loud At JD Vance Claim Kids Are Going Trans to Get Into Harvard and Yale,"Senator JD Vance recently suggested that high school kids are transitioning genders to help them get into exclusive colleges like Harvard and Yale.
The post Anderson Cooper’s CNN Panel Laughs Out Loud At JD Vance Claim Kids Are Going Trans to Get Into Harvard…",https://www.mediaite.com/tv/anderson-coopers-cnn-panel-laughs-out-loud-at-jd-vance-claim-kids-are-going-trans-to-get-into-harvard-and-yale/,https://www.mediaite.com/wp-content/uploads/2024/11/Anderson-Cooper-360-CNN-Panel-Laughs-at-JD-Vance-Comment-2024-11-01.jpg,2024-11-01T11:14:08Z,"During a recent interview with Joe Rogan, Senator JD Vance suggested that high school kids are transitioning genders to help them get into exclusive colleges like Harvard and Yale.
After Anderson Co… [+2201 chars]",,Mediaite
85,Zachary Leeman,JD Vance Tells Joe Rogan Republicans Went ‘Really Wrong’ By Attacking Hunter Biden: ‘I Want To Hang Out With’ Him!,"Republican vice presidential candidate JD Vance told Joe Rogan that Republicans went ""really wrong"" with their attacks on Hunter Biden.
The post JD Vance Tells Joe Rogan Republicans Went ‘Really Wrong’ By Attacking Hunter Biden: ‘I Want To Hang Out With’ Him!…",https://www.mediaite.com/news/jd-vance-tells-joe-rogan-republicans-went-really-wrong-by-attacking-hunter-biden-i-want-to-hang-out-with-him/,https://www.mediaite.com/wp-content/uploads/2024/10/vance-1.png,2024-10-31T18:20:58Z,"Screenshot via Joe Rogan Experience
Republican vice presidential candidate JD Vance told Joe Rogan that Republicans went “really wrong” with their attacks on Hunter Biden in an episode of The Joe Ro… [+2215 chars]",,Mediaite
86,Kathleen Culliton,'What a liar': Jaws drop at J.D. Vance's outlandish claim about Donald Trump,"Former President Donald Trump's running mate has Democrat jaws dropping after he suggested there was one thing his boss would never do.Sen. J.D. Vance told rally attendees in Aston, Pennsylvania, on Sunday that the Republican presidential nominee always had c…",https://www.rawstory.com/w-2669569261/,https://www.rawstory.com/media-library/republican-presidential-nominee-and-former-u-s-president-donald-trump-and-republican-u-s-vice-presidential-nominee-senator-jd.jpg?id=53704675&width=1200&height=600&coordinates=0%2C356%2C0%2C357,2024-11-03T23:38:54Z,"Former President Donald Trump's running mate has Democrat jaws dropping after he suggested there was one thing his boss would never do.
Sen. J.D. Vance told rally attendees in Aston, Pennsylvania, o… [+1468 chars]",,Raw Story
87,,"Vance suggests upper- and middle-class kids 'become trans' for college admissions, says Trump may earn 'normal gay guy vote' (Kit Maher/CNN)","Kit Maher / CNN:
Vance suggests upper- and middle-class kids ‘become trans’ for college admissions, says Trump may earn ‘normal gay guy vote’  —  Republican vice presidential candidate JD Vance suggested in an interview with podcast host Joe Rogan that aired …",https://www.memeorandum.com/241031/p86,"https://media.cnn.com/api/v1/images/stellar/prod/ap24304829908772.jpg?c=16x9&q=w_800,c_fill",2024-11-01T00:45:01Z,"memeorandum is an auto-generated summary of the stories that US political commentators are discussing online right now.
Unlike sister sites Techmeme and Mediagazer, it is not a human-edited news out… [+72 chars]",,Memeorandum.com
88,"Bradley Jaye, Bradley Jaye",Trump Responds to Mark Cuban: 'All Strong Women Should Be Very Angry About this Weak Man's Statement',"Donald Trump responded Thursday to Mark Cuban’s statement on The View that he is never around “strong, intelligent women.”
The post Trump Responds to Mark Cuban: ‘All Strong Women Should Be Very Angry About this Weak Man’s Statement’ appeared first on Breitba…",https://www.breitbart.com/politics/2024/10/31/trump-responds-to-mark-cuban-all-strong-women-should-be-very-angry-about-this-weak-mans-statement/,https://media.breitbart.com/media/2024/10/Mark-Cuban-and-Donald-Trump-640x335.jpeg,2024-10-31T23:02:34Z,"Donald Trump responded Thursday to Mark Cubans statement on The View that he is never around strong, intelligent women.
Trump posted on Truth Social “I surround myself with the strongest of women” a… [+1960 chars]",breitbart-news,Breitbart News
89,,Why business leaders are worried about JD Vance (Politico),"Politico:
Why business leaders are worried about JD Vance  —  They've watched the party move away from them under Donald Trump.  They're worried his chosen successor could accelerate the shift.  —  Business leaders watched with growing frustration as Donald T…",https://www.memeorandum.com/241103/p51,https://static.politico.com/e9/a2/895fb3e84fd983205e4a7cd25752/useuntil08-20-2024-trumpvance-097.jpg,2024-11-03T21:20:01Z,"memeorandum is an auto-generated summary of the stories that US political commentators are discussing online right now.
Unlike sister sites Techmeme and Mediagazer, it is not a human-edited news out… [+72 chars]",,Memeorandum.com
90,Tristan Justice,J.D. Vance: Gay People ‘Just Wanted To Be Left The Hell Alone’,J.D. Vance predicted the GOP ticket could win the 'normal gay guy vote' because 'they just wanted to be left the hell alone.',https://thefederalist.com/2024/10/31/j-d-vance-gay-people-just-wanted-to-be-left-the-hell-alone/,https://thefederalist.com/wp-content/uploads/2024/10/Vance.jpg,2024-10-31T20:04:50Z,"Republican vice presidential candidate J.D. Vance predicted the GOP ticket could win the “normal gay guy vote” because “they just wanted to be left the hell alone.”
Vance spoke about a movement that… [+3152 chars]",,The Federalist
91,Cassie B.,JD Vance says itâs in Americaâs best interest not to go to war with Iran,"The Biden administration has faced plenty of criticism for its unwavering support for Israel, with many wondering just how deep into another world war it could end up leading us. Israel and Iran are already engaged in back-and-forth missile attacks, and all o…",https://www.naturalnews.com/2024-11-01-vance-america-best-interest-no-war-iran.html,https://www.naturalnews.com/wp-content/uploads/sites/91/2024/11/JD-Vance-RNC-Vice-President-Pick.jpg,2024-11-01T06:00:00Z,"The Biden administration has faced plenty of criticism for its unwavering support for Israel, with many wondering just how deep into another world war it could end up leading us. Israel and Iran are … [+3160 chars]",,Naturalnews.com
92,,Inside Viktor Orbán's not-so-secret mission to elect Trump,Beyond the close public relationship between former President Donald Trump and Hungarian Prime Minister Viktor Orbán is what sources have described as frequent exchanges delving deeply into political and governing strategy.,https://www.cbsnews.com/news/viktor-orban-mission-to-elect-trump/,https://assets1.cbsnewsstatic.com/hub/i/r/2024/10/29/3e93d0f3-a846-47c8-a638-a098945dfbf2/thumbnail/1200x630g2/35d8e9b2706c180ec4a289b881e62627/gettyimages-1143562493.jpg?v=379420b9063a2aadbcd559df18e2d1ae,2024-11-02T10:57:40Z,"During a speech this summer in front of thousands of supporters, Hungary's far-right prime minister, Viktor Orbán, detailed the close connections he has nurtured with former President Donald Trump.
… [+11633 chars]",cbs-news,CBS News
93,Shola Lawal,"US election: How will results affect wars in Gaza, Ukraine and Sudan?",Several wars raging around the globe could escalate or peter out based on the stance of the next US president.,https://www.aljazeera.com/news/2024/11/2/us-election-how-will-results-affect-wars-in-gaza-ukraine-and-sudan,https://www.aljazeera.com/wp-content/uploads/2024/11/AP24269045611596-1730465713.jpg?resize=1920%2C1440,2024-11-02T13:07:04Z,"As leader of the foremost superpower and so-called world police, whoever sits in the United Statess White House and the decisions they make can have a huge effect on the course of conflicts around th… [+12489 chars]",al-jazeera-english,Al Jazeera English
94,bringatrailer,2006 Harley-Davidson Softail Fat Boy at No Reserve,"This 2006 Harley-Davidson Softail Fat Boy is finished in Black Pearl and is powered by an 88ci Twin Cam V-twin paired with a five-speed transmission. Equipment includes electronic fuel injection, an Arlen Ness air cleaner, a Vance & Hines Straightshots chrome…",https://bringatrailer.com/listing/2006-harley-davidson-softail-9/,https://bringatrailer.com/wp-content/uploads/2024/10/2006_harley-davidson_softail_img_1617-16296.jpeg,2024-10-31T21:45:12Z,"This 2006 Harley-Davidson Softail Fat Boy is finished in Black Pearl and is powered by an 88ci Twin Cam V-twin paired with a five-speed transmission. Equipment includes electronic fuel injection, an … [+2700 chars]",,Bringatrailer.com
95,Chris Walker,Vance Falsely Claims That Teens Are Pretending to Be Trans to Get Into College,"The GOP has made false, anti-trans statements a key talking point this election cycle.",https://truthout.org/articles/vance-falsely-claims-that-teens-are-pretending-to-be-trans-to-get-into-college/,https://truthout.org/app/uploads/2024/11/2024_1101-jd-vance-scaled.jpg,2024-11-01T18:10:08Z,"Republican vice presidential candidate Sen. J.D. Vance (R-Ohio) falsely suggested in a podcast interview on Thursday that white, upper- and middle-class teenagers applying to prestigious colleges and… [+3642 chars]",,Truthout
96,Ilya Somin,[Ilya Somin] Compendium of Writings About the 2024 Election and Issues at Stake,"As election day approaches, here are links to all my writings on the 2024 election and the issues at stake. Except where otherwise noted, these are all",https://reason.com/volokh/2024/10/31/compendium-of-writings-about-the-2024-election-and-issues-at-stake/,https://d2eehagpk5cl65.cloudfront.net/img/q60/uploads/2020/09/Votingbooth.jpg,2024-10-31T20:49:19Z,"(NA)
As election day approaches, here are links to all my writings on the 2024 election and the issues at stake. Except where otherwise noted, these are all posts published right here at the Volokh … [+3557 chars]",,Reason
97,Jesus Mesa,JD Vance Trolls Kamala Harris With One of Her Favorite Lines,"""I grew up in a working-class family,"" Vance began, pausing with a smirk before adding, ""I'm kidding.""",https://www.newsweek.com/jd-vance-trolls-kamala-harris-working-class-families-1978197,https://d.newsweek.com/en/full/2509315/jd-vance.jpg,2024-10-31T18:42:53Z,"Ohio Senator JD Vance opened a town hall in North Carolina with a line parodying one of Vice President Kamala Harris' frequent remarks in public speeches.
""I grew up in a working-class family,"" the … [+3239 chars]",newsweek,Newsweek
98,Niko Vorobyov,What’s at stake for Russia’s Putin in the US election?,"Trump's first term showed that while a win for him could help Russia in Ukraine, it would bring its own challenges, too.",https://www.aljazeera.com/news/2024/11/2/whats-at-stake-for-russia-in-the-us-election,https://www.aljazeera.com/wp-content/uploads/2024/10/AP24283746378534-1730375535.jpg?resize=1920%2C1440,2024-11-02T06:33:47Z,"With a desktop computer by his side, the secretary of state of the southern US state of Georgia on Thursday told reporters that a video spreading on social media, purporting to show Haitians voting i… [+7039 chars]",al-jazeera-english,Al Jazeera English
99,WND Staff,WATCH: Joe Rogan talks with JD Vance,Interview smashes viewer expectations,https://www.wnd.com/2024/10/watch-joe-rogan-talks-with-jd-vance/,https://www.wnd.com/wp-content/uploads/2023/08/rogan-1.jpg,2024-10-31T17:42:12Z,Copyright © 2024 WorldNetDaily,,Wnd.com
