,author,title,description,url,urlToImage,publishedAt,content,source.id,source.name
35,Todd Spangler,"UTA’s Andrea Nelson Meigs and Andrew Thau to Exit, Agency Makes Round of Cuts","Two high-profile UTA execs — partner Andrea Nelson Meigs and co-head of sports Andrew Thau — are leaving the company. In addition, UTA has made a small round of layoffs among its agent ranks. Both Thau and Nelson Meigs will be exiting UTA at the end of 2024. …",https://variety.com/2024/biz/news/uta-layoffs-andrea-nelson-meigs-andrew-thau-exiting-1236197759/,https://variety.com/wp-content/uploads/2024/11/UTA-Andrea-Nelson-Meigs-Andrew-Thau.jpg?w=1000&h=563&crop=1,2024-11-01T18:46:32Z,"Two high-profile UTA execs — partner Andrea Nelson Meigs and co-head of sports Andrew Thau — are leaving the company. In addition, UTA has made a small round of layoffs among its agent ranks.
Both T… [+1853 chars]",,Variety
36,,[Removed],[Removed],https://removed.com,,2024-11-02T19:27:22Z,[Removed],,[Removed]
37,Aimee Picchi,"Here's how much JD Vance is worth, from his bitcoin to real estate","JD Vance, former President Trump's running mate, has come a long way from his hardscrabble childhood of ""Hillbilly Elegy.""",https://www.cbsnews.com/news/jd-vance-net-worth-2024/,https://assets1.cbsnewsstatic.com/hub/i/r/2024/10/02/e20cacbb-ef8d-402f-b4f7-a33416312530/thumbnail/1200x630/9f115d45a24bca541f150c59b6c793a0/cbsn-fusion-jd-vance-asked-trump-concepts-plan-health-care-thumbnail.jpg?v=379420b9063a2aadbcd559df18e2d1ae,2024-11-01T13:00:10Z,"Vice presidential candidate JD Vance, 40, has amassed a multimillion fortune in the two decades since he left behind the hardscrabble childhood he described in his bestselling 2016 memoir ""Hillbilly … [+3047 chars]",cbs-news,CBS News
38,Intelligencer Staff,"The Gender Gap, the Garbage War, and a Taylor Swift Rumor: Live Election Updates","There are less than five days to go before the fate of the country gets decided, but don’t panic: we’re liveblogging.",http://nymag.com/intelligencer/article/2024-election-news-updates-trump-harris-oct-31-html.html,https://pyxis.nymag.com/v1/imgs/479/aab/a20cd325808c46623b72212f1b8b2fdd72-neon-Trump.1x.rsocial.w1200.jpg,2024-10-31T18:16:00Z,"J.D. Vances sit-down with podcaster Joe Rogan is out, and parts of the more than three hour long conversation quickly made the rounds on social media.
In one section, Vance revealed that Trump had c… [+1762 chars]",new-york-magazine,New York Magazine
39,Al Jazeera,Fact check: Would Trump slash social security and Medicare?,Kamala Harris claims Donald Trump would allow medical insurance companies to deny coverage for pre-existing conditions.,https://www.aljazeera.com/news/2024/10/31/fact-check-would-trump-slash-social-security-and-medicare,https://www.aljazeera.com/wp-content/uploads/2024/10/AP24305077359293-1730356082.jpg?resize=1920%2C1440,2024-10-31T12:09:10Z,"Vice President Kamala Harris is rolling out her closing argument for president in a new TV advertisement that attacks former President Donald Trump on healthcare, entitlement programmes and taxes.
W… [+8603 chars]",al-jazeera-english,Al Jazeera English
40,Stephanie Bai,What to Watch if You Need a Distraction This Week,These six movies and shows provide a thoughtful or hopeful break.,https://www.theatlantic.com/newsletters/archive/2024/11/what-to-watch-if-you-need-a-distraction-this-week/680492/,https://cdn.theatlantic.com/thumbor/kdc-TD2-PwdNxq9_MdqZ6n7UE-Y=/1x302:4251x2516/1200x625/media/img/mt/2024/11/2R56RB4/original.jpg,2024-11-03T12:00:00Z,"This is an edition of The Atlantic Daily, a newsletter that guides you through the biggest stories of the day, helps you discover new ideas, and recommends the best in culture. Sign up for it here.We… [+8426 chars]",,The Atlantic
41,Rogé Karma,The Rise of the Post-Marxist Electorate,Why do so many liberals vote against their economic self-interest?,https://www.theatlantic.com/ideas/archive/2024/10/democratic-voters-educated-populist/680462/,https://cdn.theatlantic.com/thumbor/QuaVyynpt_IFJUWgIl1mR5tdiJg=/0x56:2700x1462/1200x625/media/newsletters/2024/10/2024_10_30_marx_1127296448_1/original.jpg,2024-10-31T11:30:00Z,"This is Work in Progress, a newsletter about work, technology, and how to solve some of Americas biggest problems. Sign up here.
A simple and intuitive view of democratic politics holds that politic… [+10071 chars]",,The Atlantic
42,Nellie Andreeva,Andrea Nelson Meigs Departing As UTA Partner,"EXCLUSIVE: Talent and literary agent Andrea Nelson Meigs will be leaving UTA at the end of the year. Nelson Meigs, who joined UTA in October 2020 as a Partner following her 14-year run at ICM, is expected to take a hiatus before pursuing opportunities outside…",http://deadline.com/2024/11/andrea-nelson-meigs-leaving-uta-partner-1236122357/,https://deadline.com/wp-content/uploads/2020/10/Andrea-Nelson-Meigs-UTA.jpg?w=1000,2024-11-01T15:09:09Z,"EXCLUSIVE: Talent and literary agent Andrea Nelson Meigs will be leaving UTA at the end of the year. Nelson Meigs, who joined UTA in October 2020 as a Partner following her 14-year run at ICM, is exp… [+1559 chars]",,Deadline
43,Bonnie Kristian,Meet the voters who despise Trump but really like JD Vance,There's a small but significant subset of voters who might vote for Trump just because they want to see JD Vance in office.,https://www.msnbc.com/opinion/msnbc-opinion/never-trump-jd-vance-voters-rcna178205,"https://media-cldnry.s-nbcnews.com/image/upload/t_nbcnews-fp-1200-630,f_auto,q_auto:best/rockcms/2024-10/241031-jd-vance-ch-1412-e148f9.jpg",2024-11-02T10:00:00Z,"Since before former President Donald Trump announced Sen. JD Vance of Ohio as his running mate, conventional wisdom has held that this wasnt a great pick. Vance is historically unpopular, Democrats h… [+6622 chars]",msnbc,MSNBC
44,Erin Vanderhoof,What JD and Usha Vance Learned From Their “Tiger Mom” at Yale Law School,"Amy Chua, the professor whose 2011 parenting memoir made her a household name, looms large in the legal and political trajectories of numerous figures who have matriculated from the powerful Ivy League law school, including the Vances.",https://www.vanityfair.com/style/story/jd-and-usha-vance-amy-chua-yale-law-school,"https://media.vanityfair.com/photos/672507e13c559dacc7c84ea2/16:9/w_1280,c_limit/jd-and-usha-vance-yale.jpg",2024-11-01T17:42:02Z,"When JD Vance became Donald Trumps running mate in July, completing his transformation from vigorous critic to true MAGA believer, he left former friends from Yale Law School scratching their heads. … [+7424 chars]",,Vanity Fair
45,Eldar Mamedov,J.D. Vance Says a War With Iran Is Not in the U.S. Interest,"The vice-presidential candidate’s comments are the latest evidence of the gravity of the GOP foreign policy realignment.
The post J.D. Vance Says a War With Iran Is Not in the U.S. Interest appeared first on The American Conservative.",https://www.theamericanconservative.com/j-d-vance-says-a-war-with-iran-is-not-in-the-u-s-interest/,https://www.theamericanconservative.com/wp-content/uploads/2023/09/shutterstock_2269916667-scaled-e1695757671324.jpg,2024-11-02T04:01:00Z,"On October 26, J.D. Vance, the Republican vice-presidential candidate, marked a distance with Israel on the escalating situation in the Middle East. On the Tim Dillon Show, he acknowledged Israels ri… [+5617 chars]",the-american-conservative,The American Conservative
46,Ray Flook,"Twin Peaks: Did Joe Rogan Interview Trump, Vance From The Black Lodge?","Let me just start off by saying that I could never hate myself so much that I would watch a combined six hours of interview between Joe Rogan and ex-reality show host, multi-impeached ex-POTUS, and convicted felon Donald Trump and his VP ""little buddy,"" Sen. …",https://bleedingcool.com/tv/twin-peaks-did-joe-rogan-interview-trump-vance-from-the-black-lodge/,https://bleedingcool.com/wp-content/uploads/2024/10/MixCollage-31-Oct-2024-08-41-PM-529-2000x1125.jpg,2024-11-01T01:17:09Z,"Posted in: Opinion, streaming, TV, TV, YouTube | Tagged: donald trump, JD Vance, Joe Rogan, opinion, twin peaks
Was it just us, or did Donald Trump and JD Vance look like they were in the Black Lodg… [+5798 chars]",,Bleeding Cool News
47,"John Binder, John Binder",JD Vance Calls Out Kamala Harris for 'Mass Amnesty Bill' to Legalize Illegal Immigration,"Sen. JD Vance (R-OH) is calling out legislation promoted by Vice President Kamala Harris on the campaign trail that he says is a ""mass amnesty bill"" to effectively legalize illegal immigration to the United States.
The post JD Vance Calls Out Kamala Harris fo…",https://www.breitbart.com/politics/2024/10/31/jd-vance-calls-out-kamala-harris-for-mass-amnesty-bill-to-legalize-illegal-immigration/,https://media.breitbart.com/media/2024/10/GettyImages-2181619388-640x335.jpg,2024-10-31T23:04:17Z,Sen. JD Vance (R-OH) is calling out legislation promoted by Vice President Kamala Harris on the campaign trail that he says is a “mass amnesty bill” to effectively legalize illegal immigration to the… [+3008 chars],breitbart-news,Breitbart News
48,"Bradley Jaye, Bradley Jaye","Exclusive — JD Vance Response to Mark Cuban: ‘Insulting to My Wife,’ Melania Trump, Lara Trump and All Women Supporting Trump","Vice Presidential Candidate JD Vance responded to Mark Cuban's statement on The View that Donald Trump is never around ""strong, intelligent women.""
The post Exclusive — JD Vance Response to Mark Cuban: ‘Insulting to My Wife,’ Melania Trump, Lara Trump and All…",https://www.breitbart.com/politics/2024/10/31/exclusive-jd-vance-response-to-mark-cuban-insulting-to-my-wife-melania-trump-lara-trump-and-all-women-supporting-trump/,https://media.breitbart.com/media/2024/10/JD-Vance-Interview-640x335.jpeg,2024-10-31T22:06:27Z,"Vice Presidential Candidate JD Vance responded to Mark Cuban’s statement on The View that Donald Trump is never around “strong, intelligent women.”
Vance provided his response to Breitbart News’s Ma… [+1545 chars]",breitbart-news,Breitbart News
49,,[Removed],[Removed],https://removed.com,,2024-11-01T14:54:36Z,[Removed],,[Removed]
50,"Neil Munro, Neil Munro",JD Vance to Joe Rogan: Amnesty Will End Democracy,"An amnesty of the roughly 25 million illegal migrants in the United States would ""end democracy,"" and convert the U.S. into a one-party state like California, JD Vance, Donald Trump's hand-picked running mate, told host Joe Rogan on Thursday.
The post JD Vanc…",https://www.breitbart.com/immigration/2024/10/31/jd-vance-to-joe-rogan-amnesty-will-end-democracy/,https://media.breitbart.com/media/2024/10/JD-Vance-2-640x335.jpg,2024-10-31T22:12:39Z,"An establishment amnesty for the roughly 25 million illegal migrants in the United States would “end democracy,” and convert the U.S. into a one-party state like California, JD Vance, Donald Trump’s … [+6725 chars]",breitbart-news,Breitbart News
51,"Alana Mastrangelo, Alana Mastrangelo",Watch -- JD Vance at Turning Point Action Gen-Z Town Hall: 'You Have More to Lose than Anybody' If Kamala Harris Wins,"Sen. JD Vance warned students at a Gen-Z town hall that they ""have more to lose than anybody"" if Vice President Kamala Harris wins the 2024 election.
The post Watch — JD Vance at Turning Point Action Gen-Z Town Hall: ‘You Have More to Lose than Anybody’ If Ka…",https://www.breitbart.com/politics/2024/10/31/watch-jd-vance-turning-point-action-gen-z-town-hall-you-have-more-lose-than-anybody-if-kamala-harris-wins/,https://media.breitbart.com/media/2024/08/JD-Vance-1-640x335.jpg,2024-10-31T22:23:30Z,"Sen. JD Vance (R-OH) sat down with Turning Point Action for a Gen-Z town hall in High Point, North Carolina, on Thursday, where he warned students that they “have more to lose than anybody” if Vice P… [+3759 chars]",breitbart-news,Breitbart News
52,"Nick Gilbertson, Nick Gilbertson",Exclusive – JD Vance: Kamala Harris Running Away from Her Record Is ‘Most Audacious Thing’ in History of American Politics,"JD Vance told Breitbart News that Kamala Harris running away from her record is ""the most audacious thing that we've seen in the history of American politics.""
The post Exclusive – JD Vance: Kamala Harris Running Away from Her Record Is ‘Most Audacious Thing’…",https://www.breitbart.com/2024-election/2024/11/02/exclusive-jd-vance-kamala-harris-running-away-her-record-is-most-audacious-thing-history-american-politics/,https://media.breitbart.com/media/2024/11/JD-Vance-640x335.jpg,2024-11-02T19:35:28Z,Republican Vice Presidential nominee Sen. JD Vance (R-OH) said during his appearance on Sirius XM’s Breitbart News Saturday that Vice President Kamala Harris running away from her record is “the most… [+2389 chars],breitbart-news,Breitbart News
53,"Elizabeth Weibel, Elizabeth Weibel",JD Vance Slams Kamala Harris for Bragging About Economy: U.S. 'Lost' 28K 'Private Sector Jobs',"Sen. JD Vance (R-OH) criticized Vice President Kamala Harris for bragging about the economy in the United States despite recent data showing 28,000 private sector jobs have been lost.
The post JD Vance Slams Kamala Harris for Bragging About Economy: U.S. ‘Los…",https://www.breitbart.com/politics/2024/11/01/jd-vance-slams-kamala-harris-bragging-economy-us-lost-28k-private-sector-jobs/,https://media.breitbart.com/media/2024/11/jd-vance-sept-4-2024-gage-skidmore-flickr-640x335.jpg,2024-11-02T01:08:59Z,"Sen. JD Vance (R-OH) criticized Vice President Kamala Harris for bragging about the economy in the United States despite recent data showing 28,000 private sector jobs have been lost.
During a rally… [+1834 chars]",breitbart-news,Breitbart News
54,"Hannah Knudsen, Hannah Knudsen",Exclusive -- JD Vance Closing Argument: 'Kamala Harris Broke It; Donald Trump Will Fix It',"Vice President Kamala Harris broke it, and former President Donald Trump will fix it, Sen. JD Vance (R-OH) said during an appearance on Breitbart News Saturday, laying out the closing argument for the campaign just days ahead of the election.
The post Exclusi…",https://www.breitbart.com/radio/2024/11/02/jd-vance-closing-argument-kamala-harris-broke-it-donald-trump-will-fix-it/,https://media.breitbart.com/media/2024/11/JD-Vance-looks-at-Donald-Trump-ap-640x335.jpg,2024-11-02T16:00:09Z,"Vice President Kamala Harris broke it, and former President Donald Trump will fix it, Sen. JD Vance (R-OH) said during an appearance on Breitbart News Saturday, laying out the closing argument for th… [+3915 chars]",breitbart-news,Breitbart News
55,Laura Harris,J.D. Vance blames Kamala Harris and her policies for the consequences of government surveillance expansion,Ohio Senator and Republican vice presidential candidate J.D. Vance has blamed the policies of Vice President and Democratic presidential nominee Kamala Harris for the consequences of the expansion of government surveillance. In a recent episode of the “Tim Di…,https://www.naturalnews.com/2024-11-01-jd-vance-blames-kamala-harris-policies.html,https://www.naturalnews.com/wp-content/uploads/sites/91/2024/11/JD-Vance-RNC-Vice-President-Pick.jpg,2024-11-01T06:00:00Z,Ohio Senator and Republican vice presidential candidate J.D. Vance has blamed the policies of Vice President and Democratic presidential nominee Kamala Harris for the consequences of the expansion of… [+3848 chars],,Naturalnews.com
56,"Rachel Feltman, Tanya Lewis, Lauren J. Young, Daniel Vergano, Madison Goldberg, Fonda Mwangi",How the 2024 Election Could Change Access to Health Care in the U.S. and Influence Global Nuclear Policies,The outcome of the 2024 U.S. presidential election could reshape policies from health care at home to nuclear proliferation abroad.,https://www.scientificamerican.com/podcast/episode/how-the-2024-election-could-change-access-to-health-care-in-the-u-s-and/,https://static.scientificamerican.com/dam/m/15dfc46f0f10e613/original/SQ-Friday-EP-Art.png?m=1715878940.917&w=1200,2024-11-01T10:30:00Z,"[CLIP: Theme music]
Rachel Feltman: For Science Quickly, this is Rachel Feltman. The 2024 election is approaching fast, and we’re here to help you prep for your trip to the polls. Over the last few … [+18992 chars]",,Scientific American
57,Greg Evans,‘The View’ Skips Halloween Costumes But Can’t Exorcise Trump’s Nightmarish Bedevilment,"No costumes, but The View didn’t ignore Halloween this year, opening the show with a pre-taped dream sketch in which each of the hosts, bored to tears at a morning staff meeting as producer Brian Teta drones on and on about his podcast, dozes off and has a Tr…",http://deadline.com/2024/10/the-view-halloween-trump-1236163341/,https://deadline.com/wp-content/uploads/2024/10/Screenshot-2024-10-31-at-12.42.40 PM.png?w=1024,2024-10-31T16:57:27Z,"No costumes, but The View didn’t ignore Halloween this year, opening the show with a pre-taped dream sketch in which each of the hosts, bored to tears at a morning staff meeting as producer Brian Tet… [+2322 chars]",,Deadline
58,Ray Flook,SNL 50: VP Kamala Harris Joins Maya Rudolph for Cold Open (VIDEO),"We knew that tonight's edition of NBC's Saturday Night Live was going to be something special just by looking at the calendar. That's because tonight's John Mulaney-hosted, Chappell Roan-performing show is also the final one before U.S. voters choose between …",https://bleedingcool.com/tv/snl-50-vp-kamala-harris-joins-maya-rudolph-for-cold-open-video/,https://bleedingcool.com/wp-content/uploads/2024/11/MixCollage-02-Nov-2024-11-46-PM-415-2000x1125.jpg,2024-11-03T03:52:08Z,"Posted in: NBC, Peacock, TV | Tagged: kamala harris, saturday night live, snl
Tonight's Saturday Night Live featured VP Kamala Harris joining Maya Rudolph's VP Kamala Harris for SNL's Cold Open. Her… [+3698 chars]",,Bleeding Cool News
59,Just Jared,Who Is J.D. Vance's Wife & Does He Have Children?,"J.D. Vance is Donald Trump‘s vice presidential pick in the 2024 presidential election, which is happening in a matter of days. With his name dominating the headlines, voters are curious to know more about J.D.‘s personal life, including more about his wife an…",https://www.justjared.com/2024/11/03/who-is-j-d-vances-wife-does-he-have-children/,https://cdn01.justjared.com/wp-content/uploads/headlines/2024/11/jd-vance-wife-social.jpg,2024-11-03T21:33:45Z,"J.D. Vance is Donald Trump‘s vice presidential pick in the 2024 presidential election, which is happening in a matter of days.
With his name dominating the headlines, voters are curious to know more… [+1825 chars]",,Just Jared
60,"Hannah Knudsen, Hannah Knudsen",Exclusive -- JD Vance: 'Disgusting' that Biden Called Trump Supporters 'Garbage'; 'Imagine What They Say in Private,"It is ""disgusting"" that President Joe Biden called supporters of former President Donald Trump ""garbage"" at a campaign event for Vice President Kamala Harris, but that is likely just the tip of the iceberg, according to Sen. JD Vance, who said on Breitbart Ne…",https://www.breitbart.com/radio/2024/11/02/jd-vance-disgusting-biden-called-trump-supporters-garbage-imagine-what-they-say-private/,https://media.breitbart.com/media/2024/11/JD-Vance-speaking-pointing-up-getty-640x335.jpg,2024-11-02T16:00:52Z,"It is “disgusting” that President Joe Biden called supporters of former President Donald Trump “garbage” at a campaign event for Vice President Kamala Harris, but that is likely just the tip of the i… [+3053 chars]",breitbart-news,Breitbart News
61,Ray Flook,Saturday Night Live: VP Kamala Harris Reportedly Set to Appear Tonight,"After taking a one-week break after four new shows in a row, NBC's Saturday Night Live is returning tonight with the last SNL before U.S. voters choose between Vice President Kamala Harris and Gov. Tim Walz and ex-reality show host, multi-impeached ex-POTUS, …",https://bleedingcool.com/tv/saturday-night-live-vp-kamala-harris-reportedly-set-to-appear-tonight/,https://bleedingcool.com/wp-content/uploads/2024/11/MixCollage-02-Nov-2024-08-16-PM-1555-2000x1125.jpg,2024-11-03T00:22:08Z,"Posted in: NBC, Peacock, TV | Tagged: donald trump, kamala harris, saturday night live, snl
Reports are VP Kamala Harris will be appearing during tonight's Saturday Night Live, with host John Mulane… [+2022 chars]",,Bleeding Cool News
62,Nicole Silverio,‘Thought They Had Killed Him’: JD Vance Says Trump Considered Announcing His VP Pick At Butler Rally,"J.D. Vance said Republican nominee Donald Trump considered announcing his vice presidential pick at the notorious rally in Butler, Pennsylvania.",https://dailycaller.com/2024/10/31/jd-vance-trump-vp-pick-butler-pennsylvania/,https://cdn01.dailycaller.com/wp-content/uploads/2024/10/Screenshot-2024-10-31-at-3.16.47%e2%80%afPM-e1730402267184.png,2024-10-31T19:35:35Z,"Republican Ohio Sen. J.D. Vance said Thursday Republican nominee Donald Trump considered announcing his vice presidential pick at the notorious rally in Butler, Pennsylvania in July.
Trump seriously… [+3147 chars]",,The Daily Caller
63,Ray Flook,"SNL 50: Chappell Roan Gets The Job Done with New Track ""The Giver""","With the show being the final one before U.S. voters choose between Vice President Kamala Harris and Gov. Tim Walz and ex-reality show host, multi-impeached ex-POTUS, and convicted felon Donald Trump and Sen. JD Vance, we already tonight's edition of NBC's  S…",https://bleedingcool.com/tv/snl-50-chappell-roan-gets-the-job-done-with-new-track-the-giver/,https://bleedingcool.com/wp-content/uploads/2024/11/MixCollage-03-Nov-2024-01-33-AM-5956-2000x1125.jpg,2024-11-03T06:37:08Z,"Posted in: NBC, Peacock, TV | Tagged: Chappell Roan, saturday night live, snl
After an amazing performance of ""Pink Pony Club,"" SNL musical guest Chappell Roan got the job done big time with the new… [+3497 chars]",,Bleeding Cool News
64,Kathleen Culliton,J.D. Vance claims 'normal gay guy' backs Trump after being chased from 'homophobic' Dems,Sen. J.D. Vance (R-OH) said Thursday he and former President Donald Trump expect a difficult-to-define voting bloc will help them win the presidential election on Nov. 5. Vance told podcaster Joe Rogan on Thursday that he believes that a certain kind of man i…,https://www.rawstory.com/jd-vance-homophobic/,https://www.rawstory.com/media-library/image.jpg?id=54093320&width=1200&height=600&coordinates=0%2C542%2C0%2C543,2024-10-31T18:51:10Z,"Sen. J.D. Vance (R-OH) said Thursday he and former President Donald Trump expect a difficult-to-define voting bloc will help them win the presidential election on Nov. 5. 
Vance told podcaster Joe R… [+2247 chars]",,Raw Story
65,"Carl Gibson, AlterNet",'There’s very few people that are celebrating': Joe Rogan shuts down J.D. Vance Roe claim,"Sen. J.D. Vance (R-OH) sat down Thursday with popular podcaster Joe Rogan, and one particular exchange is turning heads on social media.While Rogan and Vance were discussing how the Supreme Court's 2022 overturning of the Roe v. Wade decision could impact nex…",https://www.rawstory.com/theres-very-few-people-that-are-celebrating-joe-rogan-shuts-down-j-d-vances-roe-claim/,https://www.rawstory.com/media-library/commentator-joe-rogan-looks-on-during-the-ufc-fight-night-event-at-prudential-center-on-april-18-2015-in-newark-new-jersey.jpg?id=27159182&width=1200&height=600&coordinates=0%2C82%2C0%2C82,2024-10-31T19:01:50Z,"Sen. J.D. Vance (R-OH) sat down Thursday with popular podcaster Joe Rogan, and one particular exchange is turning heads on social media.
While Rogan and Vance were discussing how the Supreme Court's… [+2437 chars]",,Raw Story
66,Carla St. Louis,JD Vance Says 'We Are Sleepwalking Into WWIII',The Ohio Senator expressed statements that suggest to U.S. is headed towards World War III due to Vice President Kamala Harris' leadership.,https://www.ibtimes.com/jd-vance-says-we-are-sleepwalking-wwiii-3749036,https://d.ibtimes.com/en/full/4558253/jd-vance.jpg,2024-10-31T20:34:50Z,"At a town hall in North Carolina, Sen. J.D. Vance (R-Ohio) warned that the United States is ""sleepwalking into World War III,"" emphasizing what he sees as the danger of poor leadership.
The Republic… [+2396 chars]",,International Business Times
67,Leena Nasir,JD Vance Tells Joe Rogan That ‘Emily In Paris’ Is ‘A Masterpiece’,"JD Vance casually revealed what one of his favorite new shows is, and it's so far from anything you'd ever guess.",https://dailycaller.com/2024/10/31/jd-vance-joe-rogan-experience-interview-emily-in-paris-lily-collins-masterpiece/,https://cdn01.dailycaller.com/wp-content/uploads/2024/10/GettyImages-2171386445-e1730399948694.jpg,2024-10-31T19:06:49Z,"JD Vance casually revealed what one of his favorite new shows is and it’s probably far from anything you’d ever guess.
The Republicanvice-presidential nominee appeared on the Oct. 31 episode of the … [+3467 chars]",,The Daily Caller
68,Nick Pope,One County Could Swing 2024’s Most Important Battleground State. Is Trump Positioned To Win It?,"It is nearly impossible to find a street in Bucks County, Pennsylvania, that does not have Trump-Vance and Harris-Walz signs lining the sidewalks.",https://dailycaller.com/2024/11/02/one-county-could-swing-2024-battleground-state-is-trump-positioned-to-win/,https://cdn01.dailycaller.com/wp-content/uploads/2024/10/Screen-Shot-2024-10-31-at-2.20.58-PM-e1730398919117.png,2024-11-02T17:53:12Z,"BUCKS COUNTY, Pennsylvania — It is nearly impossible to find a street in Bucks County, Pennsylvania, that does not have Trump-Vance and Harris-Walz signs lining the sidewalks.
The county is widely c… [+9585 chars]",,The Daily Caller
